{
  "$schema": "https://json-schema.org/draft/2020-12/schema",
  "$id": "https://schemas.sistematech.local/esocial/v1/esocial-request-envelope-v1.schema.json",
  "title": "eSocial request envelope v1",
  "type": "object",
  "additionalProperties": true,
  "properties": {
    "version": {
      "const": "v1"
    },
    "family": {
      "const": "request"
    },
    "request-id": {
      "type": "string",
      "minLength": 1
    },
    "correlation-id": {
      "type": "string",
      "minLength": 1
    },
    "idempotency-key": {
      "type": "string",
      "minLength": 1
    },
    "created_at": {
      "type": "string",
      "format": "date-time"
    },
    "tenant_id": {
      "type": "string",
      "minLength": 1
    },
    "environment": {
      "enum": [
        "PRODUCTION",
        "QUALIFICATION"
      ]
    },
    "event_class": {
      "enum": [
        "S-1000",
        "S-1005",
        "S-1010",
        "S-1020",
        "S-1030",
        "S-1040",
        "S-1050",
        "S-1060",
        "S-1070",
        "S-1200",
        "S-1202",
        "S-1207",
        "S-1210",
        "S-1298",
        "S-1299",
        "S-2200",
        "S-2205",
        "S-2206",
        "S-2210",
        "S-2220",
        "S-2230",
        "S-2240",
        "S-2298",
        "S-2299",
        "S-2300",
        "S-2306",
        "S-2399",
        "S-2400",
        "S-2405",
        "S-2410",
        "S-2416",
        "S-2418",
        "S-2420",
        "S-2501",
        "S-3000",
        "S-5001",
        "S-5002",
        "S-5011",
        "S-5012",
        "S-5013"
      ]
    },
    "source": {
      "type": "object",
      "additionalProperties": false,
      "properties": {
        "source_event_id": {
          "type": "string",
          "minLength": 1
        },
        "payroll_run_id": {
          "type": "string",
          "minLength": 1
        },
        "employee_id": {
          "type": "string",
          "minLength": 1
        },
        "source_entity_id": {
          "type": "string",
          "minLength": 1
        },
        "source_entity_ids": {
          "type": "array",
          "items": {
            "type": "string",
            "minLength": 1
          }
        },
        "source_system": {
          "type": "string",
          "minLength": 1
        }
      }
    },
    "kind": {
      "enum": [
        "submit",
        "tabelas",
        "trabalhador",
        "folha",
        "fechamento",
        "exclusao",
        "retorno",
        "certificado"
      ]
    },
    "payload_hash": {
      "type": "string",
      "minLength": 1
    },
    "attempt": {
      "type": "integer",
      "minimum": 0
    },
    "max-attempts": {
      "type": "integer",
      "minimum": 1
    },
    "reply-to": {
      "type": "string",
      "minLength": 1
    },
    "dead-letter-topic": {
      "type": "string",
      "minLength": 1
    },
    "payload": {
      "oneOf": [
        {
          "$ref": "./dto-s1000.schema.json"
        },
        {
          "$ref": "./dto-s1005.schema.json"
        },
        {
          "$ref": "./dto-s1010.schema.json"
        },
        {
          "$ref": "./dto-s1020.schema.json"
        },
        {
          "$ref": "./dto-s1030.schema.json"
        },
        {
          "$ref": "./dto-s1040.schema.json"
        },
        {
          "$ref": "./dto-s1050.schema.json"
        },
        {
          "$ref": "./dto-s1060.schema.json"
        },
        {
          "$ref": "./dto-s1070.schema.json"
        },
        {
          "$ref": "./dto-s1200.schema.json"
        },
        {
          "$ref": "./dto-s1202.schema.json"
        },
        {
          "$ref": "./dto-s1207.schema.json"
        },
        {
          "$ref": "./dto-s1210.schema.json"
        },
        {
          "$ref": "./dto-s1298.schema.json"
        },
        {
          "$ref": "./dto-s1299.schema.json"
        },
        {
          "$ref": "./dto-s2200.schema.json"
        },
        {
          "$ref": "./dto-s2205.schema.json"
        },
        {
          "$ref": "./dto-s2206.schema.json"
        },
        {
          "$ref": "./dto-s2210.schema.json"
        },
        {
          "$ref": "./dto-s2220.schema.json"
        },
        {
          "$ref": "./dto-s2230.schema.json"
        },
        {
          "$ref": "./dto-s2240.schema.json"
        },
        {
          "$ref": "./dto-s2298.schema.json"
        },
        {
          "$ref": "./dto-s2299.schema.json"
        },
        {
          "$ref": "./dto-s2300.schema.json"
        },
        {
          "$ref": "./dto-s2306.schema.json"
        },
        {
          "$ref": "./dto-s2399.schema.json"
        },
        {
          "$ref": "./dto-s2400.schema.json"
        },
        {
          "$ref": "./dto-s2405.schema.json"
        },
        {
          "$ref": "./dto-s2410.schema.json"
        },
        {
          "$ref": "./dto-s2416.schema.json"
        },
        {
          "$ref": "./dto-s2418.schema.json"
        },
        {
          "$ref": "./dto-s2420.schema.json"
        },
        {
          "$ref": "./dto-s2501.schema.json"
        },
        {
          "$ref": "./dto-s3000.schema.json"
        },
        {
          "$ref": "./dto-s5001.schema.json"
        },
        {
          "$ref": "./dto-s5002.schema.json"
        },
        {
          "$ref": "./dto-s5011.schema.json"
        },
        {
          "$ref": "./dto-s5012.schema.json"
        },
        {
          "$ref": "./dto-s5013.schema.json"
        }
      ]
    }
  },
  "required": [
    "version",
    "family",
    "request-id",
    "correlation-id",
    "idempotency-key",
    "created_at",
    "tenant_id",
    "environment",
    "event_class",
    "source",
    "kind",
    "payload_hash",
    "attempt",
    "max-attempts",
    "reply-to",
    "dead-letter-topic",
    "payload"
  ]
}
