{
  "version": "v1",
  "family": "request",
  "request-id": "req-request-S-1005",
  "correlation-id": "corr-S-1005",
  "idempotency-key": "esocial:v1:request:tenant-a:QUALIFICATION:S-1005:source-event-S-1005:source-entity-S-1005:-:-:sha256%3A795b6b90be55ca05989687bda042a94120e930aea053aeb1f88d1f4802c6bf4d:-:-",
  "created_at": "2026-05-05T12:00:00.000Z",
  "tenant_id": "tenant-a",
  "environment": "QUALIFICATION",
  "event_class": "S-1005",
  "source": {
    "source_event_id": "source-event-S-1005",
    "source_entity_id": "source-entity-S-1005",
    "source_system": "SGP"
  },
  "kind": "tabelas",
  "payload_hash": "sha256:795b6b90be55ca05989687bda042a94120e930aea053aeb1f88d1f4802c6bf4d",
  "attempt": 1,
  "max-attempts": 3,
  "reply-to": "sgp.esocial.submit.response",
  "dead-letter-topic": "sgp.esocial.dlq",
  "payload": {
    "eventClass": "S-1005",
    "tenantId": "tenant-a",
    "sourceEventId": "source-event-S-1005",
    "sourceEntityId": "source-entity-S-1005",
    "environment": "qualification",
    "round1Pending": true,
    "deferredReason": "builder_not_promoted_in_round0"
  }
}
