{
  "version": "v1",
  "family": "request",
  "request-id": "req-request-S-1020",
  "correlation-id": "corr-S-1020",
  "idempotency-key": "esocial:v1:request:tenant-a:QUALIFICATION:S-1020:source-event-S-1020:source-entity-S-1020:-:2026-05:sha256%3A6775558b629cada8353987ddf763a9a889336676820648a1d674806e2d9dde74:-:-",
  "created_at": "2026-05-05T12:00:00.000Z",
  "tenant_id": "tenant-a",
  "environment": "QUALIFICATION",
  "event_class": "S-1020",
  "source": {
    "source_event_id": "source-event-S-1020",
    "source_entity_id": "source-entity-S-1020",
    "payroll_run_id": "payroll-2026-05",
    "source_system": "SGP"
  },
  "kind": "tabelas",
  "payload_hash": "sha256:6775558b629cada8353987ddf763a9a889336676820648a1d674806e2d9dde74",
  "attempt": 1,
  "max-attempts": 3,
  "reply-to": "sgp.esocial.submit.response",
  "dead-letter-topic": "sgp.esocial.dlq",
  "payload": {
    "eventClass": "S-1020",
    "tenantId": "tenant-a",
    "sourceEventId": "source-event-S-1020",
    "sourceEntityId": "source-entity-S-1020",
    "environment": "qualification",
    "employerCnpj": "12345678000199",
    "validityStart": "2026-05",
    "lotationCode": "LOT01",
    "lotationTypeCode": "01",
    "fpasCode": "582",
    "thirdPartyCode": "0000"
  }
}
