{
  "version": "v1",
  "family": "request",
  "request-id": "req-request-S-2230",
  "correlation-id": "corr-S-2230",
  "idempotency-key": "esocial:v1:request:tenant-a:QUALIFICATION:S-2230:source-event-S-2230:source-entity-S-2230:-:-:sha256%3Ad07954b6f37ebfd570eee5d16348b4d72443a9143e020628b248a4f80b6830ba:-:-",
  "created_at": "2026-05-05T12:00:00.000Z",
  "tenant_id": "tenant-a",
  "environment": "QUALIFICATION",
  "event_class": "S-2230",
  "source": {
    "source_event_id": "source-event-S-2230",
    "source_entity_id": "source-entity-S-2230",
    "employee_id": "employee-1",
    "source_system": "SGP"
  },
  "kind": "trabalhador",
  "payload_hash": "sha256:d07954b6f37ebfd570eee5d16348b4d72443a9143e020628b248a4f80b6830ba",
  "attempt": 1,
  "max-attempts": 3,
  "reply-to": "sgp.esocial.submit.response",
  "dead-letter-topic": "sgp.esocial.dlq",
  "payload": {
    "eventClass": "S-2230",
    "tenantId": "tenant-a",
    "sourceEventId": "source-event-S-2230",
    "sourceEntityId": "source-entity-S-2230",
    "environment": "qualification",
    "employerCnpj": "12345678000199",
    "employeeId": "employee-1",
    "cpf": "12345678901",
    "registration": "MAT-1",
    "kind": "medical-leave",
    "startDate": "2026-05-04",
    "leaveReasonCode": "01"
  }
}
