{
  "version": "v1",
  "family": "request",
  "request-id": "req-request-S-1210",
  "correlation-id": "corr-S-1210",
  "idempotency-key": "esocial:v1:request:tenant-a:QUALIFICATION:S-1210:source-event-S-1210:source-entity-S-1210:-:2026-05:sha256%3Ae496d7a49d03b6729be2e68fe63a2a2a925b3528b3e81c154cf6ccffbb8f78c4:-:-",
  "created_at": "2026-05-05T12:00:00.000Z",
  "tenant_id": "tenant-a",
  "environment": "QUALIFICATION",
  "event_class": "S-1210",
  "source": {
    "source_event_id": "source-event-S-1210",
    "source_entity_id": "source-entity-S-1210",
    "payroll_run_id": "payroll-2026-05",
    "source_system": "SGP"
  },
  "kind": "folha",
  "payload_hash": "sha256:e496d7a49d03b6729be2e68fe63a2a2a925b3528b3e81c154cf6ccffbb8f78c4",
  "attempt": 1,
  "max-attempts": 3,
  "reply-to": "sgp.esocial.submit.response",
  "dead-letter-topic": "sgp.esocial.dlq",
  "payload": {
    "eventClass": "S-1210",
    "tenantId": "tenant-a",
    "sourceEventId": "source-event-S-1210",
    "sourceEntityId": "source-entity-S-1210",
    "environment": "qualification",
    "employerCnpj": "12345678000199",
    "competence": "2026-05",
    "paymentBatchId": "payments-2026-05",
    "paymentBatchStatus": "PAID",
    "payrollRunId": "payroll-2026-05",
    "confirmedTotal": "1000.00",
    "payments": [
      {
        "employeeId": "employee-1",
        "cpf": "12345678901",
        "amount": "1000.00",
        "paymentDate": "2026-05-25",
        "receiptReference": "1.1.0000000000000001200"
      }
    ]
  }
}
