{
  "version": "v1",
  "family": "request",
  "request-id": "req-request-S-1200",
  "correlation-id": "corr-S-1200",
  "idempotency-key": "esocial:v1:request:tenant-a:QUALIFICATION:S-1200:source-event-S-1200:source-entity-S-1200:-:2026-05:sha256%3A08bfa136bcbe1bcccc52a74a61d88e584bd9158cd014433e2234e506abe9dd00:-:-",
  "created_at": "2026-05-05T12:00:00.000Z",
  "tenant_id": "tenant-a",
  "environment": "QUALIFICATION",
  "event_class": "S-1200",
  "source": {
    "source_event_id": "source-event-S-1200",
    "source_entity_id": "source-entity-S-1200",
    "payroll_run_id": "payroll-2026-05",
    "source_system": "SGP"
  },
  "kind": "folha",
  "payload_hash": "sha256:08bfa136bcbe1bcccc52a74a61d88e584bd9158cd014433e2234e506abe9dd00",
  "attempt": 1,
  "max-attempts": 3,
  "reply-to": "sgp.esocial.submit.response",
  "dead-letter-topic": "sgp.esocial.dlq",
  "payload": {
    "eventClass": "S-1200",
    "tenantId": "tenant-a",
    "sourceEventId": "source-event-S-1200",
    "sourceEntityId": "source-entity-S-1200",
    "environment": "qualification",
    "employerCnpj": "12345678000199",
    "competence": "2026-05",
    "payrollRunId": "payroll-2026-05",
    "payrollRunStatus": "GENERATED",
    "workers": [
      {
        "employeeId": "employee-1",
        "cpf": "12345678901",
        "registration": "MAT-1",
        "categoryCode": "101",
        "rubrics": [
          {
            "rubricCode": "RUB-001",
            "ideDmDev": "DM-1",
            "amount": 1000
          }
        ]
      }
    ]
  }
}
