{
  "version": "v1",
  "family": "request",
  "request-id": "req-request-S-2200",
  "correlation-id": "corr-S-2200",
  "idempotency-key": "esocial:v1:request:tenant-a:QUALIFICATION:S-2200:source-event-S-2200:source-entity-S-2200:-:-:sha256%3A7e6824591f9e84d31dc34b0945def985e8b35200a54e1bce2ab237d4cf6e43f0:-:-",
  "created_at": "2026-05-05T12:00:00.000Z",
  "tenant_id": "tenant-a",
  "environment": "QUALIFICATION",
  "event_class": "S-2200",
  "source": {
    "source_event_id": "source-event-S-2200",
    "source_entity_id": "source-entity-S-2200",
    "employee_id": "employee-1",
    "source_system": "SGP"
  },
  "kind": "trabalhador",
  "payload_hash": "sha256:7e6824591f9e84d31dc34b0945def985e8b35200a54e1bce2ab237d4cf6e43f0",
  "attempt": 1,
  "max-attempts": 3,
  "reply-to": "sgp.esocial.submit.response",
  "dead-letter-topic": "sgp.esocial.dlq",
  "payload": {
    "eventClass": "S-2200",
    "tenantId": "tenant-a",
    "sourceEventId": "source-event-S-2200",
    "sourceEntityId": "source-entity-S-2200",
    "environment": "qualification",
    "employerCnpj": "12345678000199",
    "employeeId": "employee-1",
    "cpf": "12345678901",
    "name": "Contract Fixture Worker",
    "birthDate": "1990-01-01",
    "admissionDate": "2026-05-01",
    "registration": "MAT-1",
    "categoryCode": "101",
    "contractType": "CLT",
    "jobCode": "DEV-1"
  }
}
